{
  "$schema": "https://json-schema.org/draft/2020-12/schema",
  "$id": "#/components/schemas/ApplicationResponseType",
  "title": "ApplicationResponseType",
  "type": "object",
  "properties": {
    "application_summary": {
      "$ref": "#/components/schemas/AppSummaryResponse"
    },
    "end_user_summary": {
      "$ref": "#/components/schemas/EndUserSummaryResponse"
    },
    "health_status": {
      "type": "string",
      "example": "active"
    },
    "id": {
      "type": "integer",
      "example": 100
    },
    "language": {
      "type": "string",
      "example": "example_string"
    },
    "last_reported_at": {
      "type": "string",
      "format": "date-time",
      "example": "2026-04-18T14:30:00Z"
    },
    "links": {
      "$ref": "#/components/schemas/ApplicationLinksResponse"
    },
    "name": {
      "type": "string",
      "example": "example-resource-01"
    },
    "reporting": {
      "type": "boolean",
      "example": true
    },
    "settings": {
      "$ref": "#/components/schemas/AppSettingsResponse"
    }
  }
}